{
  "schema_version": "0.1",
  "meta": {
    "timestamp": 1770413888,
    "git_commit": "5a2f5fd8e613fcaf411c2dd031760fc4e729ab64",
    "seed_list": [
      0
    ],
    "suite": "tools",
    "ood": false,
    "quick": true,
    "config": {
      "mode": "stage4",
      "variants": [
        "full"
      ],
      "use_skills": false,
      "skill_mode": "handcrafted",
      "n_latent_skills": 0,
      "masked_only": false,
      "unmasked_only": false,
      "eval_max_steps": 200,
      "eval_episodes": 3,
      "lifecycle_eval_episodes": 2,
      "lifecycle_online_episodes": 2,
      "self_model_batches": 20,
      "self_reflection_batches": 5,
      "stage3c_batches": 5,
      "stage3c_collect_episodes": 2,
      "run_self_reflection": false,
      "run_stage3c": false,
      "run_lifecycle": false
    }
  },
  "overall": {
    "agi_score": 0.26666666666666666,
    "notes": [],
    "gates": {
      "gate0": "pass",
      "gate1": "na",
      "gate2": "na"
    }
  },
  "suites": [
    {
      "name": "tools",
      "status": "ok",
      "score": 0.26666666666666666,
      "metrics": {
        "pass_rate_masked": 1.0,
        "pass_rate_unmasked": 0.3333333333333333,
        "mean_steps_to_pass_unmasked": 15.0,
        "invalid_action_rate": null,
        "mask_pred_f1": 0.4087759815242494,
        "mask_pred_auc": 0.4314159292035398,
        "bc_pretrain_used": true,
        "action_mask_dropout_prob": 0.0,
        "mean_invalid_mass": 0.34010201692581177,
        "ood_gap": null
      },
      "per_env": [
        {
          "env": "tool_env/basic",
          "seed": 0,
          "variant": "full",
          "status": "ok",
          "pass": null,
          "pass_rate_masked": null,
          "pass_rate_unmasked": null,
          "steps": null,
          "invalid_rate": null
        },
        {
          "env": "repo_tool_env/train:proc_mixed_loop,test:proc_mixed_loop",
          "seed": 0,
          "variant": "full",
          "status": "ok",
          "pass": false,
          "pass_rate_masked": 1.0,
          "pass_rate_unmasked": 0.3333333333333333,
          "steps": 15.0,
          "invalid_rate": null
        }
      ],
      "notes": []
    }
  ]
}