{
  "schema_version": "0.1",
  "meta": {
    "timestamp": 1770407343,
    "git_commit": "d4069452f289ed9c7d5dcbf664b958814c0a0ed9",
    "seed_list": [
      0
    ],
    "suite": "core",
    "ood": false,
    "quick": true,
    "config": {
      "mode": "stage4",
      "variants": [
        "full"
      ],
      "use_skills": false,
      "skill_mode": "handcrafted",
      "n_latent_skills": 0,
      "masked_only": false,
      "unmasked_only": false,
      "eval_max_steps": 200,
      "eval_episodes": 3,
      "lifecycle_eval_episodes": 2,
      "lifecycle_online_episodes": 2,
      "self_model_batches": 20,
      "self_reflection_batches": 5,
      "stage3c_batches": 5,
      "stage3c_collect_episodes": 2,
      "run_self_reflection": false,
      "run_stage3c": false,
      "run_lifecycle": false
    }
  },
  "overall": {
    "agi_score": 0.0,
    "notes": [
      "no_suite_scores_available"
    ],
    "gates": {
      "gate0": "pass",
      "gate1": "na",
      "gate2": "na"
    }
  },
  "suites": [
    {
      "name": "core",
      "status": "ok",
      "score": null,
      "metrics": {
        "mean_return": 44.98315688967705,
        "test_mean_return": 26.079359591007233,
        "ood_gap": null
      },
      "per_env": [
        {
          "env": "gridworld/basic",
          "seed": 0,
          "variant": "full",
          "status": "ok",
          "pass": null,
          "pass_rate_masked": null,
          "pass_rate_unmasked": null,
          "steps": null,
          "invalid_rate": null
        },
        {
          "env": "minigrid/minigrid-empty,minigrid-doorkey,test:minigrid-lavacrossing",
          "seed": 0,
          "variant": "full",
          "status": "ok",
          "pass": null,
          "pass_rate_masked": null,
          "pass_rate_unmasked": null,
          "steps": null,
          "invalid_rate": null,
          "timeout_episodes": 1
        }
      ],
      "notes": []
    }
  ]
}