{
  "schema_version": "0.2",
  "meta": {
    "timestamp": 1771176795,
    "git_commit": "f2145c2a508ba78bef81481f5c77ac06e0320ff8",
    "seed_list": [
      0,
      1,
      2,
      3,
      4
    ],
    "suite": "lifelong",
    "ood": false,
    "quick": true,
    "config": {
      "mode": "stage4",
      "variants": [
        "full"
      ],
      "use_skills": false,
      "skill_mode": "handcrafted",
      "n_latent_skills": 0,
      "masked_only": false,
      "unmasked_only": false,
      "eval_max_steps": 200,
      "force_cpu": false,
      "auto_force_cpu_repo": false,
      "eval_episodes": 8,
      "lifecycle_eval_episodes": 8,
      "lifecycle_online_episodes": 16,
      "self_model_batches": 20,
      "self_reflection_batches": 5,
      "stage3c_batches": 5,
      "stage3c_collect_episodes": 2,
      "n_steps": 256,
      "stage2_updates": 3,
      "stage4_updates": 3,
      "eval_policy": "greedy",
      "run_self_reflection": false,
      "run_stage3c": false,
      "run_lifecycle": false
    },
    "config_hash": "89fcdf91a4a57505",
    "run_manifest": {
      "config_hash": "89fcdf91a4a57505",
      "seed_list": [
        0,
        1,
        2,
        3,
        4
      ],
      "seed_count": 5,
      "git_commit": "f2145c2a508ba78bef81481f5c77ac06e0320ff8",
      "suite": "lifelong",
      "ood": false,
      "quick": true,
      "environment": {
        "platform": "win32",
        "python_version": "3.12.10",
        "executable": "C:\\Users\\loval\\AppData\\Local\\Programs\\Python\\Python312\\python.exe",
        "machine": "AMD64",
        "processor": "Intel64 Family 6 Model 165 Stepping 5, GenuineIntel",
        "torch_version": "2.10.0+cpu",
        "cuda_available": false
      }
    }
  },
  "overall": {
    "agi_score": 0.5851742286825066,
    "notes": [],
    "gates": {
      "gate0": "pass",
      "gate1": "na",
      "gate2": "na",
      "gate3": "na",
      "gate4": "na"
    },
    "capabilities": {
      "generalization_score": null,
      "sample_efficiency_score": null,
      "robustness_score": null,
      "tool_workflow_score": null
    },
    "confidence": null
  },
  "suites": [
    {
      "name": "lifelong",
      "status": "ok",
      "score": 0.5851742286825066,
      "ci": {
        "n": 5,
        "mean": 0.5347205734212941,
        "std": 0.07394911966666065,
        "se": 0.03307105169018396,
        "half_width": 0.06481926131276057,
        "lower": 0.46990131210853353,
        "upper": 0.5995398347340547
      },
      "metrics": {
        "forgetting_gap": 0.20308393970464067,
        "forward_transfer": 1.7202551288519583
      },
      "per_env": [
        {
          "env": "gridworld/basic",
          "seed": 0,
          "variant": "full",
          "status": "ok",
          "pass": null,
          "pass_rate_masked": null,
          "pass_rate_unmasked": null,
          "steps": null,
          "invalid_rate": null
        },
        {
          "env": "gridworld/basic",
          "seed": 1,
          "variant": "full",
          "status": "ok",
          "pass": null,
          "pass_rate_masked": null,
          "pass_rate_unmasked": null,
          "steps": null,
          "invalid_rate": null
        },
        {
          "env": "gridworld/basic",
          "seed": 2,
          "variant": "full",
          "status": "ok",
          "pass": null,
          "pass_rate_masked": null,
          "pass_rate_unmasked": null,
          "steps": null,
          "invalid_rate": null
        },
        {
          "env": "gridworld/basic",
          "seed": 3,
          "variant": "full",
          "status": "ok",
          "pass": null,
          "pass_rate_masked": null,
          "pass_rate_unmasked": null,
          "steps": null,
          "invalid_rate": null
        },
        {
          "env": "gridworld/basic",
          "seed": 4,
          "variant": "full",
          "status": "ok",
          "pass": null,
          "pass_rate_masked": null,
          "pass_rate_unmasked": null,
          "steps": null,
          "invalid_rate": null
        }
      ],
      "notes": []
    }
  ]
}