{
  "schema_version": "0.1",
  "meta": {
    "timestamp": 1767282059,
    "git_commit": "60e4513a51107d5f7fd7639317c25f053fe7d8e9",
    "seed_list": [
      0,
      1,
      2
    ],
    "suite": "tools",
    "ood": false,
    "quick": true,
    "config": {
      "mode": "stage4",
      "variants": [
        "full"
      ],
      "use_skills": false,
      "skill_mode": "handcrafted",
      "n_latent_skills": 0,
      "masked_only": false,
      "unmasked_only": false,
      "eval_max_steps": 200,
      "eval_episodes": 3,
      "lifecycle_eval_episodes": 2,
      "lifecycle_online_episodes": 2,
      "self_model_batches": 20,
      "self_reflection_batches": 5,
      "stage3c_batches": 5,
      "stage3c_collect_episodes": 2,
      "run_self_reflection": false,
      "run_stage3c": false,
      "run_lifecycle": false
    }
  },
  "overall": {
    "agi_score": 0.4444444444444444,
    "notes": [],
    "gates": {
      "gate0": "pass",
      "gate1": "na",
      "gate2": "na"
    }
  },
  "suites": [
    {
      "name": "tools",
      "status": "ok",
      "score": 0.4444444444444444,
      "metrics": {
        "pass_rate_masked": 0.8888888888888888,
        "pass_rate_unmasked": 0.4444444444444444,
        "mean_steps_to_pass_unmasked": 12.0,
        "invalid_action_rate": null,
        "mask_pred_f1": null,
        "mask_pred_auc": null,
        "bc_pretrain_used": false,
        "action_mask_dropout_prob": 0.0,
        "mean_invalid_mass": null,
        "ood_gap": null
      },
      "per_env": [
        {
          "env": "tool_env/basic",
          "seed": 0,
          "variant": "full",
          "status": "ok",
          "pass": null,
          "pass_rate_masked": null,
          "pass_rate_unmasked": null,
          "steps": null,
          "invalid_rate": null
        },
        {
          "env": "tool_env/basic",
          "seed": 1,
          "variant": "full",
          "status": "ok",
          "pass": null,
          "pass_rate_masked": null,
          "pass_rate_unmasked": null,
          "steps": null,
          "invalid_rate": null
        },
        {
          "env": "tool_env/basic",
          "seed": 2,
          "variant": "full",
          "status": "ok",
          "pass": null,
          "pass_rate_masked": null,
          "pass_rate_unmasked": null,
          "steps": null,
          "invalid_rate": null
        },
        {
          "env": "repo_tool_env/train:proc_mixed_loop,test:proc_mixed_loop",
          "seed": 0,
          "variant": "full",
          "status": "ok",
          "pass": false,
          "pass_rate_masked": 1.0,
          "pass_rate_unmasked": 0.3333333333333333,
          "steps": 17.0,
          "invalid_rate": null
        },
        {
          "env": "repo_tool_env/train:proc_mixed_loop,test:proc_mixed_loop",
          "seed": 1,
          "variant": "full",
          "status": "ok",
          "pass": false,
          "pass_rate_masked": 0.6666666666666666,
          "pass_rate_unmasked": 0.3333333333333333,
          "steps": 5.0,
          "invalid_rate": null
        },
        {
          "env": "repo_tool_env/train:proc_mixed_loop,test:proc_mixed_loop",
          "seed": 2,
          "variant": "full",
          "status": "ok",
          "pass": true,
          "pass_rate_masked": 1.0,
          "pass_rate_unmasked": 0.6666666666666666,
          "steps": 13.0,
          "invalid_rate": null
        }
      ],
      "notes": []
    }
  ]
}