{
  "schema_version": "0.1",
  "meta": {
    "timestamp": 1770471322,
    "git_commit": "2f8ea3e6acdb2f5bedfa3ac254d7e32349afdfc0",
    "seed_list": [
      0
    ],
    "suite": "tools",
    "ood": false,
    "quick": false,
    "config": {
      "mode": "stage4",
      "variants": [
        "full"
      ],
      "use_skills": false,
      "skill_mode": "handcrafted",
      "n_latent_skills": 0,
      "masked_only": false,
      "unmasked_only": false,
      "eval_max_steps": 200,
      "force_cpu": true,
      "eval_episodes": 20,
      "lifecycle_eval_episodes": 20,
      "lifecycle_online_episodes": 50,
      "self_model_batches": 200,
      "self_reflection_batches": 200,
      "stage3c_batches": 50,
      "stage3c_collect_episodes": 10,
      "run_self_reflection": true,
      "run_stage3c": true,
      "run_lifecycle": true
    }
  },
  "overall": {
    "agi_score": 0.5,
    "notes": [],
    "gates": {
      "gate0": "pass",
      "gate1": "na",
      "gate2": "na"
    }
  },
  "suites": [
    {
      "name": "tools",
      "status": "ok",
      "score": 0.5,
      "metrics": {
        "pass_rate_masked": 1.0,
        "pass_rate_unmasked": 0.5,
        "mean_steps_to_pass_unmasked": 3.4,
        "invalid_action_rate": null,
        "mask_pred_f1": 0.244228432563791,
        "mask_pred_auc": 0.7605459500239342,
        "bc_pretrain_used": true,
        "action_mask_dropout_prob": 0.0,
        "mean_invalid_mass": 0.23352934420108795,
        "ood_gap": null
      },
      "per_env": [
        {
          "env": "tool_env/basic",
          "seed": 0,
          "variant": "full",
          "status": "ok",
          "pass": null,
          "pass_rate_masked": null,
          "pass_rate_unmasked": null,
          "steps": null,
          "invalid_rate": null
        },
        {
          "env": "repo_tool_env/train:proc_mixed_loop,test:proc_mixed_loop",
          "seed": 0,
          "variant": "full",
          "status": "ok",
          "pass": true,
          "pass_rate_masked": 1.0,
          "pass_rate_unmasked": 0.5,
          "steps": 3.4,
          "invalid_rate": null
        }
      ],
      "notes": []
    }
  ]
}